{
  "schema_version": 1,
  "generation_id": "fixture-generation/1",
  "runtime_id": "runtime-fixture",
  "session_id": "session-fixture",
  "cursor": "fixture-generation/1:1",
  "gap": false,
  "reconciliation_required": false,
  "has_more": false,
  "retention_seconds": 900,
  "events": [{
    "schema_version": 1,
    "generation_id": "fixture-generation/1",
    "sequence": "1",
    "event": "policy.decision",
    "correlation_id": "request-fixture",
    "request_id": "request-fixture",
    "session_id": "session-fixture",
    "data": { "event_id": "event-fixture", "delivery_id": "delivery-fixture", "verdict": "allow", "phase": "admission", "config_version": "policy-fixture" }
  }]
}
